{
  "formatVersion": 1,
  "id": "11111111-1111-1111-1111-111111111111",
  "title": "Clair de Lune",
  "subtitle": null,
  "composer": "Claude Debussy",
  "arranger": null,
  "lyricist": null,
  "genre": "Classical",
  "tags": ["piano", "impressionist"],
  "parts": ["part-piano"],
  "createdAt": "2026-09-23T00:00:00Z",
  "modifiedAt": "2026-09-23T00:00:00Z",
  "source": {
    "type": "pdf-import",
    "details": { "originalFilename": "clair-de-lune.pdf" }
  }
}
